{
  "job_id": "rl300_msp_yellow_p1",
  "package_model": "RL300_SAFE",
  "cad_source": {
    "file_path": "3D models/V2RL300-SAFE.glb",
    "format": "glb",
    "up_axis": "Z",
    "unit_scale": 1.0
  },
  "camera": {
    "preset": "P1_FRONT_ISO",
    "focal_length_mm": 50.0,
    "elevation_deg": 14.0,
    "azimuth_deg": 45.0,
    "target_offset": [0.0, 0.0, 0.45]
  },
  "livery": {
    "preset": "msp_standard_yellow",
    "body_color_hex": "#F7B500",
    "body_roughness": 0.35,
    "body_clearcoat": 0.25,
    "frame_color_hex": "#1B1B1B",
    "frame_roughness": 0.55,
    "decal_pack": "MSP"
  },
  "lighting": {
    "preset": "studio_dark",
    "intensity_multiplier": 1.1,
    "color_temperature_k": 5200,
    "shadow_catcher": true
  },
  "output": {
    "width": 1920,
    "height": 1080,
    "samples": 128,
    "engine": "CYCLES",
    "denoiser": "OPENIMAGEDENOISE",
    "passes": {
      "beauty": true,
      "alpha_mask": true,
      "depth_map": true,
      "surface_normals": true,
      "contact_shadow": true
    },
    "output_dir": "./output/rl300_msp_yellow_p1"
  },
  "compositing": {
    "enabled": true,
    "background_plate": "Renderings/env_excavationPit-sunlit.png",
    "ai_environment_prompt": "commercial dewatering excavation pit with muddy soil, pump discharge water channel, high contrast morning sunlight",
    "shadow_opacity": 0.85,
    "edge_feather_px": 1
  }
}
